{
  "contract_name": "tubeads.plan",
  "contract_version": "1.0",
  "producer": {
    "skill_id": "tubeads-skill-lite",
    "version": "1.0.0",
    "edition": "lite"
  },
  "plan_id": "local-2460e11a44964c7f",
  "created_at": "2026-10-04T17:11:03+00:00",
  "platform": "google_ads",
  "scope": "youtube_video_planning",
  "status": "PLAN_READY",
  "publish_authorized": false,
  "external_reads": false,
  "external_writes": false,
  "review_status": "HUMAN_REVIEW_REQUIRED",
  "generation_mode": "deterministic_starter",
  "input": {
    "brand": "範例學院",
    "offer": "廣告入門課程",
    "audience": "想練習廣告規劃的初學者",
    "market": "台灣",
    "goal": "leads",
    "success_action": "提交課程諮詢表單",
    "landing_page_url": "https://example.com/course",
    "landing_page_text": "合成範例：頁面介紹課程內容，設有課程諮詢表單。未提供價格、保證、開課日或真實成效。",
    "currency": "TWD",
    "total_budget": 6000,
    "duration_days": 14,
    "video_duration_seconds": 30,
    "facts": [
      {
        "id": "F1",
        "text": "課程內容包含廣告規劃練習。",
        "source": "合成教學範例，不是 AI Ads Academy 的真實課程承諾。"
      }
    ],
    "constraints": [
      "不得宣稱保證收益。",
      "未提供價格，不得補寫優惠。"
    ],
    "data_label": "synthetic"
  },
  "budget": {
    "currency": "TWD",
    "total_limit": 6000,
    "duration_days": 14,
    "daily_average": 428.57,
    "note": "僅為總額除以天數的規劃均值，不是平台每日預算設定；不得直接四捨五入後乘回作為支出承諾。"
  },
  "deliverables": {
    "duration_seconds": 30,
    "duration_source": "user_supplied",
    "hook_variants": [
      {
        "id": "local-hook-1",
        "text": "正在了解廣告入門課程？先看清楚內容再決定。"
      },
      {
        "id": "local-hook-2",
        "text": "比較不同方案時，哪些資訊值得先確認？"
      },
      {
        "id": "local-hook-3",
        "text": "從具體內容，了解一個選擇。"
      }
    ],
    "segments": [
      {
        "start": 0,
        "end": 5,
        "role": "hook",
        "voiceover": "正在了解廣告入門課程？先看清楚內容再決定。",
        "visual": "展示主題與品牌；不要延後到最後才說明內容。",
        "evidence_ids": []
      },
      {
        "start": 5,
        "end": 14,
        "role": "explanation",
        "voiceover": "課程內容包含廣告規劃練習。",
        "visual": "拍攝可核實的內容導覽或操作示範。",
        "evidence_ids": [
          "F1"
        ]
      },
      {
        "start": 14,
        "end": 23,
        "role": "consideration",
        "voiceover": "先確認內容與適用情境，再決定是否符合你的需求。",
        "visual": "列出選擇條件；未知條件保留待確認。",
        "evidence_ids": []
      },
      {
        "start": 23,
        "end": 30,
        "role": "cta",
        "voiceover": "查看完整介紹，了解下一步。",
        "visual": "品牌收尾搭配單一行動入口。",
        "evidence_ids": []
      }
    ],
    "shot_list": [
      "展示主題與品牌；不要延後到最後才說明內容。",
      "拍攝可核實的內容導覽或操作示範。",
      "列出選擇條件；未知條件保留待確認。",
      "品牌收尾搭配單一行動入口。"
    ],
    "cta": "查看完整介紹，了解下一步。",
    "test_plan": [
      {
        "id": "local-test-1",
        "variable": "opening_hook",
        "variants": [
          "local-hook-1",
          "local-hook-2",
          "local-hook-3"
        ],
        "hold_constant": [
          "後續腳本與總時長",
          "CTA",
          "素材形式",
          "客群與量測口徑"
        ],
        "decision_rule": "先比對觀看與成功行動的完整路徑；觀看率高不等於轉換較好，資料不足時不選贏家。",
        "budget_allocation": null
      }
    ],
    "review_notes": [
      "秒數是分鏡規劃，不是配音實測；拍攝前須試讀，過長時縮短文案。",
      "預設 30 秒只是起稿假設，不是平台要求；素材規格與活動支援須於上線前確認。",
      "腳本不是影片檔；未生成、下載、上傳任何影片、音樂或創作者素材。"
    ],
    "campaign_note": "YouTube 影片投放屬 Google Ads 規劃範圍；本工具僅負責影片企劃，不建立活動。"
  },
  "measurement": {
    "success_action": "提交課程諮詢表單",
    "tracking_status": "NOT_VERIFIED",
    "baseline": null,
    "target": null,
    "attribution_window": null
  },
  "assumptions": [
    "這是固定規則產生的企劃起稿；訊息角度是待驗證假設，不是成效預測。",
    "輸入事實由使用者提供，未經本工具外部查證；合成範例不得當作真實案例。",
    "平台目標與素材規格未作 live 驗證；人工上線前須在實際帳號確認。"
  ],
  "open_questions": [],
  "validation_scope": "local_structure_only"
}
